{
  "schema_version": 1,
  "skill": "tasteroll",
  "class": "generative",
  "trigger": {
    "positive": [
      "Rapid design exploration or surprise direction without a full interview",
      "A product needs varied-but-tasteful prototypes to compare before committing",
      "A user says 'roll the dice', 'surprise me', or 'show me options'"
    ],
    "negative": [
      "The user wants to commit to a specific direction by hand",
      "A shipped public surface needs the full strict gate",
      "The request is to improve an existing site rather than generate a new direction"
    ],
    "adjacent_skills": ["design-system-interview", "improve-existing-website", "tastecheck-pass"]
  },
  "exclusions": [
    "Do not roll outside the design rails or bypass the audit findings",
    "Do not present a rolled design as a hand-interviewed committed direction",
    "Do not skip the audit — findings are mandatory fixes regardless of seed",
    "Do not skip the relaxed gate — random inputs still need contrast and readability checks"
  ],
  "inputs": {
    "required": ["A numeric seed or instruction to derive one"],
    "optional": ["Preference constraints (e.g., 'dark mode only')", "Locked dimensions from previous rolls", "Chance MCP endpoint for multi-source entropy"]
  },
  "outputs": {
    "primary": "A seeded DESIGN-SYSTEM.md with resolved findings, rolled choices, and gate evidence",
    "artifacts": ["DESIGN-SYSTEM.md", "resolved-findings", "rolled-choices", "relaxed-gate-report"],
    "handoff_fields": ["seed", "resolved_findings", "locked_dimensions", "reference", "personality", "aesthetic", "type", "color_mode", "density", "rhythm", "signature", "imagery", "motion", "gate_result"]
  },
  "stop_conditions": [
    "Stop when the output will be a shipped public surface — escalate to tastecheck-pass strict gate",
    "Stop if the user rejects the rolled direction and wants to answer the interview manually — hand off to design-system-interview"
  ],
  "handoff": {
    "receives_from": ["design-system-interview", "improve-existing-website"],
    "sends_to": ["color-system", "web-typography", "spacing-system", "theming", "responsive-layout", "art-direction", "micro-motion", "component-states", "data-viz", "empty-states", "form-ux", "humanize-copy"]
  },
  "self_check_shape": "table_with_evidence",
  "required_evidence_fields": ["status", "reason", "remediation", "evidence", "provenance"],
  "context_budget": {"skill_md_max_tokens": 5000, "resource_max_tokens": 6000},
  "notes": "Tasteroll is the proof-of-thesis skill: constraints produce taste even from random inputs. It separates deterministic mandatory fixes (audit findings) from seed-dependent aesthetic choices (rolled dimensions). The lock/reroll interaction model enables progressive commitment through rapid iteration."
}
