{"schema_version":1,"skill":"i18n-ready","class":"repair","trigger":{"positive":["A UI or copy system must survive English/Spanish expansion, locale formatting, bidi, or locale-native voice."],"negative":["The request is only English copy polish or a non-locale accessibility defect."],"adjacent_skills":["humanize-copy","responsive-layout","a11y-pass"]},"exclusions":["Do not translate word-for-word when locale-native meaning is required.","Do not use fixed widths or concatenated strings that fail expansion or bidi."],"inputs":{"required":["supported locales","source UI/copy","expansion and direction constraints"],"optional":["translation glossary","locale fixtures","screenshots"]},"outputs":{"primary":"multilingual resilience repair ledger","artifacts":["locale risk matrix","layout/formatting fixes","native voice notes","evidence-backed self-check"],"handoff_fields":["locale","surface","risk","fix","measurement","provenance"]},"stop_conditions":["Stop when supported locales or source meaning are undefined.","Hand off general accessibility defects to a11y-pass and voice rewriting to humanize-copy."],"handoff":{"receives_from":["humanize-copy","responsive-layout","form-ux"],"sends_to":["a11y-pass","tastecheck-pass"]},"self_check_shape":"table_with_evidence","required_evidence_fields":["status","reason","remediation","evidence","provenance"],"context_budget":{"skill_md_max_tokens":5000,"resource_max_tokens":6000}}
