{
  "schema_version": 1,
  "skill": "color-system",
  "class": "generative",
  "trigger": {
    "positive": [
      "A design needs a cohesive palette, color ramp, semantic tokens, or contrast repair",
      "A theme needs source color roles"
    ],
    "negative": [
      "The request is only to map existing semantic tokens between light, dark, or forced-colors themes",
      "The request is for typography, spacing, or layout without color decisions"
    ],
    "adjacent_skills": [
      "theming",
      "a11y-pass",
      "data-viz"
    ]
  },
  "exclusions": [
    "Do not deliver an unmeasured palette",
    "Do not use raw color values as component contracts"
  ],
  "inputs": {
    "required": [
      "Brand or product hue direction",
      "Target surfaces and text roles"
    ],
    "optional": [
      "Existing tokens",
      "Dark-mode requirements",
      "Wide-gamut and legacy-browser constraints"
    ]
  },
  "outputs": {
    "primary": "A brief-derived OKLCH ramp and semantic color-token system with measured pair evidence",
    "artifacts": [
      "primitive color ramp",
      "semantic color-token map",
      "contrast table"
    ],
    "handoff_fields": [
      "dominant_hue",
      "accent",
      "neutral_strategy",
      "semantic_tokens",
      "contrast_pairs"
    ]
  },
  "stop_conditions": [
    "Pause when the required foreground-background roles are unknown",
    "Do not claim accessibility without measured real pairs"
  ],
  "handoff": {
    "receives_from": [
      "design-system-interview",
      "deslop-ui",
      "improve-existing-website",
      "tasteroll"
    ],
    "sends_to": [
      "theming",
      "data-viz",
      "a11y-pass"
    ]
  },
  "self_check_shape": "table_with_evidence",
  "required_evidence_fields": [
    "status",
    "reason",
    "remediation",
    "evidence",
    "provenance"
  ],
  "context_budget": {
    "skill_md_max_tokens": 5000,
    "resource_max_tokens": 6000
  }
}
