{"schema_version":1,"skill":"cognitive-a11y","class":"repair","trigger":{"positive":["A flow imposes avoidable memory, attention, predictability, reading, or recovery load for ADHD, autistic, dyslexic, or other neurodivergent users."],"negative":["The issue is only color contrast, semantic markup, or translation expansion."],"adjacent_skills":["a11y-pass","i18n-ready","form-ux"]},"exclusions":["Do not flatten personality or remove useful complexity without evidence.","Do not diagnose users or present a profile as a universal rule."],"inputs":{"required":["user task and context","observed cognitive friction","recovery and time-pressure constraints"],"optional":["research evidence","existing analytics","content inventory"]},"outputs":{"primary":"prioritized cognitive repair ledger preserving product voice","artifacts":["profile-aware findings","repair priorities","evidence-backed self-check"],"handoff_fields":["profile","friction","severity","preserved_signal","repair","evidence"]},"stop_conditions":["Stop when the task context or observed friction is unknown.","Hand off semantic/contrast defects to a11y-pass and locale defects to i18n-ready."],"handoff":{"receives_from":["improve-existing-website","form-ux","empty-states"],"sends_to":["a11y-pass","humanize-copy","tastecheck-pass"]},"self_check_shape":"table_with_evidence","required_evidence_fields":["status","reason","remediation","evidence","provenance"],"context_budget":{"skill_md_max_tokens":5000,"resource_max_tokens":6000}}
