{
  "schema_version": 1,
  "skill": "tastecheck-pass",
  "class": "gate",
  "trigger": {"positive": ["A finished frontend artifact needs an evidence-backed ship decision.", "A pipeline report must aggregate specialist self-checks, browser evidence, and provenance."], "negative": ["The artifact is still at the direction or implementation stage.", "The request asks for taste feedback without a defined spec and measurable evidence."], "adjacent_skills": ["a11y-pass", "deslop-ui", "humanize-copy"]},
  "exclusions": ["Never infer execution from a file existing or a claimed checkmark.", "Never turn missing required measurement into n/a without a valid subject-absence reason.", "Never let report presentation alter canonical evidence rows, measurements, skips, or verdict."],
  "inputs": {"required": ["design-system or inferred-system artifact", "applicable self-check evidence", "browser/measured evidence"], "optional": ["fix log", "screenshots", "console trace", "accessibility auditor output"]},
  "outputs": {"primary": "fail-closed evidence ledger with a deterministic verdict and actionable gate report", "artifacts": ["canonical evidence rows", "deterministic execution report with distinct failed checks", "linked presentation report", "verdict and remediation list"], "handoff_fields": ["skill", "check_id", "status", "reason", "remediation", "evidence", "provenance"]},
  "stop_conditions": ["Fail when the required spec is absent or the artifact was not built to it.", "Fail when any required evidence row is missing, forged, or contradictory.", "Fail when browser, cold-load, keyboard, zoom, theme, or reduced-motion evidence is required but absent."],
  "handoff": {"receives_from": ["a11y-pass", "cognitive-a11y", "i18n-ready", "deslop-ui", "humanize-copy"], "sends_to": []},
  "self_check_shape": "ledger_with_verdict",
  "required_evidence_fields": ["status", "reason", "remediation", "evidence", "provenance"],
  "context_budget": {"skill_md_max_tokens": 5000, "resource_max_tokens": 6000},
  "notes": "Canonical rows and verdict are deterministic. Three same-brief runs may vary their response architecture, visual-decision framing, and prose voice only when the linked report preserves every canonical fact, distinct failure, measurement, skip reason, provenance, and authoritative verdict. A single undifferentiated ledger is incomplete."
}
