{
  "schema_version": 1,
  "skill": "component-states",
  "class": "generative",
  "trigger": {"positive": ["A control has interaction states missing or inconsistent with its semantics.", "An async, selected, invalid, or keyboard interaction needs an explicit state matrix."], "negative": ["The request is only about form copy or validation timing.", "The request is only about page-level loading, empty, or error regions."], "adjacent_skills": ["form-ux", "empty-states", "a11y-pass", "micro-motion"]},
  "exclusions": ["Do not invent page-level empty states or validation policy.", "Do not treat color or animation as the only state signal.", "Do not report a state as implemented without an observable DOM/CSS/ARIA artifact."],
  "inputs": {"required": ["target component or control", "interaction model", "design-system tokens or explicit constraints"], "optional": ["existing markup", "existing state styles", "browser or accessibility findings"]},
  "outputs": {"primary": "component lifecycle contract and implementation guidance", "artifacts": ["state matrix with lifecycle transitions and state ownership", "ARIA/state mapping", "interaction and recovery rules", "evidence-backed self-check"], "handoff_fields": ["component", "state", "trigger", "state_owner", "entry_guard", "exit_or_recovery", "semantic_attribute", "visual_treatment", "evidence"]},
  "stop_conditions": ["Stop when the component semantics or interactive states cannot be identified.", "Stop and hand off when the issue is a page-level data-region state rather than a control state.", "Stop if the available tokens cannot provide a visible focus or state treatment; report the token gap."],
  "handoff": {"receives_from": ["design-system-interview", "improve-existing-website", "theming"], "sends_to": ["form-ux", "empty-states", "a11y-pass", "micro-motion", "tastecheck-pass"]},
  "self_check_shape": "table_with_evidence",
  "required_evidence_fields": ["status", "reason", "remediation", "evidence", "provenance"],
  "context_budget": {"skill_md_max_tokens": 5000, "resource_max_tokens": 6000},
  "notes": "Generative outputs may vary in response architecture, concrete token-backed treatment, and prose voice, but must preserve lifecycle ownership, confirmation, interaction guards, recovery, semantic coverage, and accessibility invariants. A ledger without those operational rules is incomplete."
}
