{"schema_version":1,"skill":"a11y-pass","class":"repair","trigger":{"positive":["A rendered interface needs WCAG 2.2 AA repair findings verified by keyboard, browser, or measurement."],"negative":["The request is only cognitive load or multilingual expansion without an accessibility defect."],"adjacent_skills":["cognitive-a11y","i18n-ready","component-states"]},"exclusions":["Do not self-attest a fix without browser or source evidence.","Do not treat an automated audit as complete coverage."],"inputs":{"required":["rendered artifact or source","target standard and user paths","observable accessibility findings"],"optional":["audit output","screenshots","assistive technology notes"]},"outputs":{"primary":"prioritized WCAG repair ledger with measured verification","artifacts":["finding/severity ledger","before/after evidence","remaining-risk handoff"],"handoff_fields":["criterion","path","severity","fix","measurement","provenance"]},"stop_conditions":["Stop when the user path or target artifact is unavailable.","Stop when a finding needs cognitive or locale expertise rather than a WCAG repair."],"handoff":{"receives_from":["component-states","form-ux","responsive-layout","theming","art-direction","cognitive-a11y","color-system","data-viz","deslop-ui","empty-states","i18n-ready","improve-existing-website","micro-motion","web-typography"],"sends_to":["tastecheck-pass"]},"self_check_shape":"table_with_evidence","required_evidence_fields":["status","reason","remediation","evidence","provenance"],"context_budget":{"skill_md_max_tokens":5000,"resource_max_tokens":6000}}
